{
  "copyright_holder_ref": {
    "artifact_id": "copyright-assignment",
    "digest": {
      "algorithm": "sha256",
      "value": "aaaaaaaaaaaaaaaaaaaaaaaaaaaaaaaaaaaaaaaaaaaaaaaaaaaaaaaaaaaaaaaa"
    },
    "media_type": "application/pdf"
  },
  "custody": "owner_controlled",
  "media_ref": {
    "artifact_id": "media-synthetic-sample-001",
    "digest": {
      "algorithm": "sha256",
      "value": "eeeeeeeeeeeeeeeeeeeeeeeeeeeeeeeeeeeeeeeeeeeeeeeeeeeeeeeeeeeeeeee"
    },
    "media_type": "video/mp4"
  },
  "notes": "Synthetic contract fixture; no media and no real person exists.",
  "participants": [],
  "publication_grant": "verified_clear",
  "record_id": "media-grant-synthetic-sample-001",
  "rehosting_permitted": false,
  "sample_id": "synthetic-sample-001",
  "schema_name": "MediaGrantV1",
  "schema_version": "1.0.0",
  "training_permitted": false,
  "venue_permission": {
    "grant_ref": {
      "artifact_id": "venue-permission",
      "digest": {
        "algorithm": "sha256",
        "value": "ffffffffffffffffffffffffffffffffffffffffffffffffffffffffffffffff"
      },
      "media_type": "application/pdf"
    },
    "state": "verified_clear"
  }
}
